{"deletedAt":"2026-08-21T14:35:00Z","formatVersion":1,"logicalPath":"Documents/report.txt","logicalPathHash":"64545dc8166d9ca0a725175d4a1f24a4b8d3908a0aa12453052af27681e4ac52","priorContentHash":"4d9673acb1cb0d6209f8014b33f1f530aa3ab0f22433da675b87765b2e03af31","priorManifestRevisionId":"01982fe2-245a-7ea2-c3e4-3456789abcde","protocol":"sluice.remote","retainUntil":"2027-02-21T14:35:00Z","revision":{"createdAt":"2026-08-21T14:35:00Z","deviceId":"01982fe2-216a-7691-b2d3-23456789abcd","deviceSequence":9,"parentRevisionIds":["01982fe2-245a-7ea2-c3e4-3456789abcde"],"revisionId":"01982fe2-256a-7fb3-d4e5-456789abcdef"},"rootId":"01982fe2-1f5a-7b80-a1c2-123456789abc"}
